{
  "request_ref": "req_support_001",
  "account_ref": "acct_demo_001",
  "product_ref": "prod_core_platform",
  "case_ref": "case_existing_001",
  "severity_category": "sev_high",
  "status_categories": [
    "new",
    "open",
    "pending_internal"
  ],
  "duplicate_scope_category": "same_account_product_open",
  "lookup_policy_ref": "policy_ticket_duplicate_read"
}
